{
  "acceptanceCriteria": [
    "Linear GraphQL is environment-key-only, fully paginated, retry-bounded, reconciled, idempotent, and redacted.",
    "Preflight verifies workspace, SAAS team, project, ordinary states, labels, owner, repository, endpoints, and supervisor compatibility before mutation.",
    "WIP reconciliation and local-first Todo plus autonomous selection are complete, deterministic, race-safe, and one-issue-only.",
    "Selected manual or semi-autonomous work reconciles exact autonomous authority and removes autonomous only when safe.",
    "Incomplete and external work receive deterministic refinement or external-integration proposals without invented product intent.",
    "Material decisions and publication retry requests are deduplicated, owner-authorized, exact-syntax, ordered, and consumed once.",
    "Follow-up creation is limited to one independently actionable achievable prerequisite; product decisions create no speculative task.",
    "ntfy is an idempotent redacted attention channel for actionable unattended states and remains quiet for routine/no-work/transient states.",
    "Migration dry-run is fully paginated, mutation-free, and reports every candidate, rejection, and proposed action.",
    "Focused fixtures, generated projections, durable docs, and the repository aggregate validation pass at exact PR head and exact merge SHA."
  ],
  "artifactFolder": "C:\\dev\\luchdom\\ai-config\\docs-ai\\004-saas-47-linear-selection-decisions-and-ntfy-cont",
  "artifactInventory": [
    "workflow.json",
    "2026-07-19-saas-47-linear-selection-decisions-and-ntfy-cont-plan.md",
    "2026-07-19-saas-47-linear-selection-decisions-and-ntfy-cont-tasks.md",
    "2026-07-19-saas-47-linear-selection-decisions-and-ntfy-cont-audit.md",
    "2026-07-19-saas-47-linear-selection-decisions-and-ntfy-cont-re-audit.md",
    "2026-07-19-saas-47-linear-selection-decisions-and-ntfy-cont-implementation.md",
    "2026-07-19-saas-47-linear-selection-decisions-and-ntfy-cont-code-review.md",
    "2026-07-19-saas-47-linear-selection-decisions-and-ntfy-cont-code-re-review.md",
    "2026-07-19-saas-47-linear-selection-decisions-and-ntfy-cont-code-review-3.md",
    "2026-07-19-saas-47-linear-selection-decisions-and-ntfy-cont-code-review-4.md",
    "2026-07-21-saas-47-linear-selection-decisions-and-ntfy-cont-code-review-5.md",
    "2026-07-21-saas-47-linear-selection-decisions-and-ntfy-cont-code-review-6.md",
    "2026-07-21-saas-47-linear-selection-decisions-and-ntfy-cont-code-review-7.md",
    "2026-07-21-saas-47-linear-selection-decisions-and-ntfy-cont-qa.md",
    "2026-07-21-saas-47-linear-selection-decisions-and-ntfy-cont-qa-final.md",
    "2026-07-21-saas-47-linear-selection-decisions-and-ntfy-cont-documentation.md",
    "2026-07-21-saas-47-linear-selection-decisions-and-ntfy-cont-completion.md",
    "2026-07-21-saas-47-linear-selection-decisions-and-ntfy-cont-pr-description.md"
  ],
  "assumptionsDecisionRefs": [],
  "completionBoundary": "merge",
  "currentArtifactStage": "completion",
  "deliverySummary": {
    "audit1": {
      "artifact": "2026-07-19-saas-47-linear-selection-decisions-and-ntfy-cont-audit.md",
      "findings": {
        "p1": 0,
        "p2": 2,
        "p3": 0
      },
      "verdict": "failed"
    },
    "codeReReview1": {
      "artifact": "2026-07-19-saas-47-linear-selection-decisions-and-ntfy-cont-code-re-review.md",
      "findings": {
        "p1": 3,
        "p2": 3,
        "p3": 0
      },
      "resolvedPriorFindings": [
        "notification-cas",
        "owner-substitution"
      ],
      "verdict": "failed"
    },
    "codeReview1": {
      "artifact": "2026-07-19-saas-47-linear-selection-decisions-and-ntfy-cont-code-review.md",
      "findings": {
        "p1": 2,
        "p2": 4,
        "p3": 0
      },
      "verdict": "failed"
    },
    "codeReview3": {
      "artifact": "2026-07-19-saas-47-linear-selection-decisions-and-ntfy-cont-code-review-3.md",
      "findings": {
        "p1": 2,
        "p2": 2,
        "p3": 0
      },
      "resolvedPriorAreas": [
        "attestation-forgery",
        "ttl-dedup",
        "attention-taxonomy",
        "semantic-record-validation",
        "graphql-error-readback"
      ],
      "verdict": "failed"
    },
    "codeReview4": {
      "artifact": "2026-07-19-saas-47-linear-selection-decisions-and-ntfy-cont-code-review-4.md",
      "findings": {
        "p1": 3,
        "p2": 1,
        "p3": 0
      },
      "resolvedPriorAreas": [
        "terminal-replay",
        "recovery-concurrency",
        "post-dispatch-readback"
      ],
      "verdict": "failed"
    },
    "codeReview5": {
      "artifact": "2026-07-21-saas-47-linear-selection-decisions-and-ntfy-cont-code-review-5.md",
      "findings": {
        "p1": 2,
        "p2": 1,
        "p3": 0
      },
      "resolvedPriorAreas": [
        "verified-pagination-selection",
        "verified-pagination-migration",
        "original-owner-hard-crash-recovery"
      ],
      "verdict": "failed"
    },
    "codeReview6": {
      "artifact": "2026-07-21-saas-47-linear-selection-decisions-and-ntfy-cont-code-review-6.md",
      "findings": {
        "p1": 2,
        "p2": 0,
        "p3": 0
      },
      "resolvedPriorAreas": [
        "closed-provider-normalization",
        "recovery-generation-advancement"
      ],
      "verdict": "failed"
    },
    "codeReview7": {
      "artifact": "2026-07-21-saas-47-linear-selection-decisions-and-ntfy-cont-code-review-7.md",
      "findings": {
        "p1": 0,
        "p2": 0,
        "p3": 0
      },
      "focusedTests": {
        "failed": 0,
        "passed": 53
      },
      "resolvedPriorAreas": [
        "production-closed-operation-boundary",
        "recovery-generation-fencing"
      ],
      "verdict": "pass"
    },
    "completion": {
      "artifact": "2026-07-21-saas-47-linear-selection-decisions-and-ntfy-cont-completion.md",
      "completionBoundary": "merge",
      "status": "ready-for-publication"
    },
    "documentation": {
      "artifact": "2026-07-21-saas-47-linear-selection-decisions-and-ntfy-cont-documentation.md",
      "verdict": "pass"
    },
    "implementation": {
      "artifact": "2026-07-19-saas-47-linear-selection-decisions-and-ntfy-cont-implementation.md",
      "focusedTests": {
        "failed": 0,
        "passed": 22
      },
      "liveProviderExecution": "disabled",
      "targetedSupervisorTests": {
        "failed": 0,
        "passed": 24
      },
      "verdict": "ready-for-code-review"
    },
    "plan": {
      "artifact": "2026-07-19-saas-47-linear-selection-decisions-and-ntfy-cont-plan.md",
      "designRequired": false,
      "verdict": "ready-for-tasking"
    },
    "pullRequest": {
      "artifact": "2026-07-21-saas-47-linear-selection-decisions-and-ntfy-cont-pr-description.md",
      "status": "drafted"
    },
    "qaFinal": {
      "aggregateDurationSeconds": 816.736,
      "aggregateTests": {
        "failed": 0,
        "passed": 248
      },
      "artifact": "2026-07-21-saas-47-linear-selection-decisions-and-ntfy-cont-qa-final.md",
      "focusedTests": {
        "failed": 0,
        "passed": 59
      },
      "verdict": "pass"
    },
    "qaInitial": {
      "aggregateValidation": "timed-out-unverified",
      "artifact": "2026-07-21-saas-47-linear-selection-decisions-and-ntfy-cont-qa.md",
      "focusedTests": {
        "failed": 0,
        "passed": 59
      },
      "verdict": "failed-incomplete"
    },
    "reAudit": {
      "artifact": "2026-07-19-saas-47-linear-selection-decisions-and-ntfy-cont-re-audit.md",
      "findings": {
        "p1": 0,
        "p2": 0,
        "p3": 0
      },
      "verdict": "pass"
    },
    "revision1": {
      "planTasksRevisedFor": [
        "complete-actionable-ntfy-triggers",
        "atomic-local-before-linear-claim-recovery"
      ],
      "status": "ready-for-re-audit"
    },
    "task": {
      "artifact": "2026-07-19-saas-47-linear-selection-decisions-and-ntfy-cont-tasks.md",
      "taskCount": 6,
      "verdict": "ready-for-audit"
    }
  },
  "design": {
    "reason": "Transport and deterministic control-plane behavior only; no product UI or interaction changes.",
    "required": false
  },
  "goal": "SAAS-47: Add Linear selection, decisions/follow-ups, and ntfy control plane",
  "nonGoals": [
    "Live Linear backlog or status migration",
    "Live ntfy publish or configuration",
    "GitHub publication, hosted checks, SaaS wrapper, scheduler, or product feature work",
    "Reimplementation of SAAS-45 or SAAS-46 base and supervisor primitives"
  ],
  "physicalWorktreeFingerprint": "sha256:ec10d90a90d5d5aa018df7cfb870f5be7e7bb9167cf06ae30af1875a79e5ac32",
  "repositoryKey": "ai-config",
  "repositoryRoot": "C:\\dev\\luchdom\\ai-config",
  "revision": 16,
  "riskFlags": [
    "provider-ambiguity",
    "credential-redaction",
    "pagination-completeness",
    "wip-race",
    "decision-authorization",
    "notification-idempotency"
  ],
  "schemaVersion": "2.0",
  "slug": "saas-47-linear-selection-decisions-and-ntfy-cont",
  "supersededArtifactNames": [],
  "tracking": {
    "externalId": "SAAS-47",
    "provider": "linear"
  },
  "workKey": "004",
  "workSource": "local",
  "workflow": "semi-autonomous",
  "workflowId": "b2a59c64-d8a8-4e5f-ade6-1a4a7818da6d"
}
